"id_intencao","palavras_chave","tipo_resposta","resposta_padrao","pergunta_followup","peso"
"combinado_tamanho_em_produto","tem camiseta plus|tem moletom plus|polo plus size|vestido plus size|legging plus|tem camiseta infantil|polo infantil|legging infantil|tamanho infantil de moletom|infantil tem em camiseta|polo no tamanho gg|camiseta xgg|vestido em g4","combinada","Consultar lookup_tamanho_produto com slots {produto, grade}. Confirma disponibilidade da grade no produto.","Me diga qual produto e qual grade (adulto PP-XGG / plus G1-G4 / infantil 2-14 anos)?","9"
"combinado_gramatura_produto_uso","qual gramatura pra camiseta|qual peso de tecido|tecido grosso pra inverno|tecido leve pra verĂŁo|camiseta pra verĂŁo|moletom pra inverno|gramatura ideal pra polo|tecido encorpado|gramatura corporativa","combinada","Consultar lookup_gramatura com slots {produto, uso}. Retorna faixa de gramatura recomendada em g/mÂ˛.","Me confirma: qual produto e pra qual uso (verĂŁo, inverno, corporativo, esporte)?","9"
"combinado_b2b_uniforme_completo","uniforme empresa preĂ§o|uniforme empresa prazo|uniforme com logo prazo|uniforme escolar prazo|uniforme escolar preĂ§o|uniforme corporativo orĂ§amento|orĂ§amento uniforme","combinada","Uniforme corporativo: mĂ­nimo 50 peĂ§as, personalizaĂ§ĂŁo inclusa (logo bordado ou silk). Prazo 25 a 35 dias Ăşteis com personalizaĂ§ĂŁo. Valor depende do tipo (polo, jaleco, avental) e da tĂŠcnica. Vou te encaminhar ao setor de vendas pra orĂ§amento personalizado.","Me confirma: quantas peĂ§as, tipo de uniforme (polo, jaleco, avental), e tĂŠcnica de personalizaĂ§ĂŁo (silk ou bordado)?","9"
"combinado_pedido_completo","orĂ§amento completo|orĂ§amento total|fechar pedido|monta orĂ§amento|simulaĂ§ĂŁo de pedido|fazer cotaĂ§ĂŁo","combinada","Pra simular um pedido, preciso de: produto, quantidade, personalizaĂ§ĂŁo (se tiver), cor, tamanho. Posso dar prazo e faixa indicativa de valor, mas o fechamento ĂŠ com o setor de vendas.","Me passa: produto + quantidade + personalizaĂ§ĂŁo + cor + tamanho.","9"
"status_pedido","status do pedido|andamento do pedido|meu pedido|meu lote|saiu do corte|foi para a costura|estĂĄ no corte|estĂĄ na costura|etapa do meu pedido|fase do meu pedido|previsĂŁo de tĂŠrmino|quando termina meu pedido|quando fica pronto meu pedido|acompanhar meu pedido|FF-20","combinada","Consultar lookup_pedidos com slot {numero_pedido}. Se nĂŁo informado, solicitar o nĂşmero do pedido. Retornar etapa atual, data prevista e se pode alterar.","Pode me informar o nĂşmero do pedido? Ex: FF-2025-0389","9"
"alterar_pedido_especifico","alterar tamanho|mudar tamanho|trocar tamanho|alterar cor|mudar cor do pedido|ainda dĂĄ tempo de alterar|posso alterar|posso mudar|antes do corte|antes de cortar|dĂĄ tempo","combinada","Consultar lookup_pedidos com slot {numero_pedido}. Verificar campo pode_alterar. Se sim, informar que ainda ĂŠ possĂ­vel e orientar a contatar vendas. Se nĂŁo, informar etapa atual e que alteraĂ§Ăľes sĂŁo inviĂĄveis.","Pode me informar o nĂşmero do pedido para verificar se ainda estĂĄ na fase de modelagem?","9"
"viabilidade_producao","capacidade tĂŠcnica|capacidade de produĂ§ĂŁo|consegue produzir|dĂĄ para produzir|tem capacidade|matĂŠria-prima disponĂ­vel|tem material|tem tecido disponĂ­vel|tem algodĂŁo|tem dry fit|tem malha|produz em|produzir em|em 5 dias|em 3 dias|em uma semana|em quanto tempo consegue|prazo curto","combinada","Consultar lookup_capacidade_produtiva + lookup_estoque_materiais com slots {quantidade, produto, tecido, prazo_desejado}. Verificar ocupaĂ§ĂŁo dos setores e disponibilidade do tecido. Retornar viabilidade com justificativa.","Para verificar a viabilidade, preciso saber: produto, quantidade, tecido e prazo desejado.","9"
"consumo_tecido","quantos metros|quantas metros|metro de tecido|metros de tecido|quanto de tecido|tecido suficiente|2 metros|5 metros|tenho metros|usando apenas|com apenas|dĂĄ para fazer|dĂĄ para produzir com|metros bastam|metros sĂŁo suficientes","combinada","Consultar lookup_consumo_tecido com slots {produto, quantidade, metragem}. Calcular se a metragem informada ĂŠ suficiente para a quantidade de peĂ§as. Retornar quantos metros sĂŁo necessĂĄrios e se a metragem informada cobre.","Para calcular, preciso saber: produto, quantidade de peĂ§as e a metragem de tecido disponĂ­vel.","9"
"registrar_pedido","registrar pedido|registrar um pedido|fazer um pedido|fazer pedido|criar pedido|cadastrar pedido|abrir pedido|novo pedido|quero fazer um pedido|quero registrar|quero encomendar","crud","(Fluxo de conversa â CREATE) Coleta produto, quantidade, cor, tamanho, tecido e personalizaĂ§ĂŁo e grava no pedidos.csv gerando o ID. A lĂłgica fica em bot/pedidos/criar.py; a coleta no responder.","Vamos registrar seu pedido! Qual produto vocĂŞ quer produzir?","9"
