"id_intencao","palavras_chave","tipo_resposta","resposta_padrao","pergunta_followup","peso"
"cat_moletons","moletom|moletons|jaqueta|capuz|sweatshirt|hoodie|jaqueta moletom|corta-vento|puffer|casaco","direta","Linha de moletons: flanelado (inverno), peluciado (meia estaĂ§ĂŁo), com capuz, sem capuz, com zĂ­per (jaqueta moletom). TambĂŠm jaqueta corta-vento e jaqueta puffer. Gramaturas de 280g a 380g.","","6"
"cat_calcas","calĂ§a|calcas|jeans|alfaiataria|jogger|legging|short|bermuda|calĂ§a moletom|calĂ§a social|skinny|wide leg","direta","Linha de calĂ§as: jeans (5 modelagens â skinny, reta, wide leg, mom, flare), alfaiataria, jogger, legging, calĂ§a moletom, bermuda esportiva e short jeans. Modelagens femininas, masculinas e unissex.","","6"
"cat_vestidos","vestido|vestidos|vestido midi|vestido longo|vestido de festa|vestido camisa|vestido moletom|vestidinho","direta","Linha de vestidos: bĂĄsico de malha, midi viscose, longo de festa (sob demanda), vestido camisa, vestido moletom (estilo casual). Trabalhamos do PP ao G4.","","6"
"cat_uniformes","uniforme|uniformes|uniforme corporativo|uniforme empresa|jaleco|avental|uniforme escolar|uniforme industrial|epi|enxoval profissional","direta","Uniformes corporativos: polo, camisa social, jaleco, avental, conjuntos industriais, linha saĂşde e alimentaĂ§ĂŁo. Pedido mĂ­nimo 50 peĂ§as, personalizaĂ§ĂŁo inclusa (logo, nome do colaborador).","","6"
"cat_infantil","infantil|crianĂ§a|crianca|kids|roupa infantil|moda infantil|bebĂŞ|bebe|conjunto infantil","direta","Linha infantil: camisetas, conjuntos, moletons, vestidinhos e bermudas. Grade de 2 a 14 anos com modelagem prĂłpria. Tecidos certificados OEKO-TEX (pele sensĂ­vel, sem corantes agressivos).","","6"
"cat_nao_fazemos","fazem calĂ§ado|fazem sapato|fazem tĂŞnis|fazem acessĂłrio|fazem bolsa|fazem joia|fazem roupa Ă­ntima|fazem cueca|fazem calcinha|fazem sutiĂŁ|fazem biquĂ­ni|fazem maiĂ´","direta","A Fashion Flow trabalha apenas com vestuĂĄrio (parte de cima e parte de baixo do corpo). NĂŁo fazemos calĂ§ado, acessĂłrio (bolsa, cinto), joia, roupa Ă­ntima (cueca, calcinha, sutiĂŁ) nem moda praia (biquĂ­ni, maiĂ´).","","6"
"sugestao_produto","sugestĂŁo de produto|sugere produto|me indica peĂ§a|me sugere peĂ§a|recomenda peĂ§a|recomendaĂ§ĂŁo de peĂ§a|o que vocĂŞs tĂŞm|que peĂ§a vocĂŞ indica|o que voce indica|me indica|indica um produto|sugere uma peca","guiada","Te ajudo a escolher! Para qual ocasiĂŁo vocĂŞ procura?","Escolha uma opĂ§ĂŁo: Casual / dia a dia|Trabalho / corporativo|Esporte / academia|Festa / ocasiĂŁo especial|Inverno|VerĂŁo|Uniforme empresa|Presente","4"
"sug_casual","casual|dia a dia|cotidiano|para usar todo dia|peĂ§a bĂĄsica|bĂĄsico|basico|peĂ§a de uso diĂĄrio","direta","Para o dia a dia indico nossas peĂ§as mais versĂĄteis: camiseta bĂĄsica (algodĂŁo 100%), camiseta premium pima, jogger, moletom oversized. Saem em todas as 12 cores de estoque e sĂŁo as mais pedidas da linha casual.","","6"
"sug_trabalho","trabalho|corporativo|escritĂłrio|ambiente formal|reuniĂŁo|reuniao|business casual","direta","Para trabalho indico: camisa polo, camisa social, calĂ§a alfaiataria, vestido camisa. Ambiente formal prefira tons neutros (preto, marinho, branco, cinza); ambiente criativo, tons mais vivos.","","6"
"sug_esporte","esporte|academia|treino|exercĂ­cio|corrida|yoga|pilates|crossfit|funcional|atividade fĂ­sica","direta","Para esporte indico: camiseta dry fit (poliĂŠster com toque seco), legging suplex, bermuda esportiva, regata. Tecidos para suor, secagem rĂĄpida e elasticidade.","","6"
"sug_festa","festa|evento|formatura|casamento|aniversĂĄrio|ocasiĂŁo especial|ocasiao especial|jantar|gala","direta","Para festa indico: vestido longo (sob demanda, 20 a 30 dias Ăşteis), vestido midi viscose, camisa social premium. Para ocasiĂľes muito especiais, oferecemos modelagem exclusiva.","","6"
"sug_inverno","inverno|frio|peĂ§a de inverno|peĂ§a quente|peĂ§a pra frio|aquecer|quentinho|epoca fria|algo quente","direta","Para inverno indico: moletom flanelado (380g), jaqueta puffer, calĂ§a jeans pesada, peĂ§as de lĂŁ (sob demanda). SobreposiĂ§Ăľes funcionam melhor que uma peĂ§a muito grossa sĂł.","","6"
"sug_verao","verĂŁo|verao|calor|peĂ§a leve|peĂ§a fresca|peĂ§a pra calor|peĂ§a de verĂŁo|fresquinho|algo fresco|algo leve|leve e fresco","direta","Para verĂŁo indico: linho, viscose, algodĂŁo leve (140g), camiseta regata, vestido midi de malha, bermuda. Cores claras esquentam menos.","","6"
"sug_uniforme","sugestĂŁo de uniforme|qual uniforme|indica uniforme|melhor uniforme","direta","Para uniforme empresarial fazemos atendimento completo: polo (mais usado), camisa social, jaleco, avental, conjuntos. Inclui logo bordado ou silk, nome do colaborador opcional. MĂ­nimo 50 peĂ§as.","","6"
"sug_presente","presente|presentear|presente pra namorada|presente pra namorado|presente pra mĂŁe|presente pra pai|presente de aniversĂĄrio|gift","direta","Para presente indico: peĂ§as premium (algodĂŁo pima, alfaiataria leve), vestido midi, moletom personalizado com nome bordado. Embalamos em saco kraft com tag personalizada se solicitado no ato do pedido.","","6"
"tecidos","tecido|tecidos|pano|panos|fibra|que tecido|quais tecidos|qualidade do tecido|composiĂ§ĂŁo do tecido","guiada","Sobre tecidos, o que vocĂŞ quer saber?","Escolha uma opĂ§ĂŁo: Lista de tecidos disponĂ­veis|ComposiĂ§ĂŁo de cada peĂ§a|Origem dos tecidos|SugestĂŁo por uso|Tecido para pele sensĂ­vel|NĂŁo trabalhamos com","4"
"tec_disponiveis","quais tecidos|tecidos disponĂ­veis|lista de tecidos|tecidos que trabalham|o que vocĂŞs usam|tipos de tecido","direta","Trabalhamos com: algodĂŁo (bĂĄsico, penteado, pima), poliĂŠster (incluindo rPET reciclado), viscose, linho, malha mista, moletom flanelado e peluciado, suplex, dry fit, lĂŁ, jeans (vĂĄrias gramaturas) e tencel. NĂŁo trabalhamos com couro animal nem seda convencional.","","6"
"tec_composicao","composiĂ§ĂŁo|composicao|porcentagem|% algodĂŁo|% poliĂŠster|do que ĂŠ feito|de que ĂŠ feito|material da peĂ§a","direta","ComposiĂ§ĂŁo varia por produto, sempre indicada na etiqueta. Exemplos: camiseta bĂĄsica 100% algodĂŁo; moletom 80% algodĂŁo / 20% poliĂŠster; dry fit 95% poliĂŠster / 5% elastano; jeans 98% algodĂŁo / 2% elastano; viscose pura 100% viscose.","","6"
"tec_origem","origem do tecido|de onde vem o tecido|fornecedor de tecido|tecelagem|malharia|tecido nacional|tecido importado","direta","Compramos tecido de malharias e tecelagens brasileiras (Santa Catarina, Minas Gerais e SĂŁo Paulo). Para algodĂŁo certificado, trabalhamos com fornecedores que comprovem origem (BCI ou orgĂ˘nico). NĂŁo compramos tecidos com origem nĂŁo rastreĂĄvel.","","6"
"tec_pele_sensivel","pele sensĂ­vel|pele sensivel|alĂŠrgico|alergico|alergia|dermatite|bebĂŞ|crianĂ§a|hipoalergĂŞnico|sem corante","direta","Para pele sensĂ­vel indico: algodĂŁo 100% certificado OEKO-TEX (sem substĂ˘ncias nocivas), bambu (hipoalergĂŞnico) e tencel. Toda nossa linha infantil usa esses critĂŠrios. Evite poliĂŠster puro, fechos metĂĄlicos em contato direto com a pele e corantes agressivos.","","6"
"tec_couro","couro|couro animal|couro vegano|couro sintĂŠtico|fazem couro|trabalham couro","direta","NĂŁo trabalhamos com couro animal por questĂŁo de sustentabilidade e bem-estar animal. TambĂŠm nĂŁo usamos couro sintĂŠtico em larga escala (PVC tem alto impacto ambiental). Para peĂ§as com aparĂŞncia de couro, usamos tecidos com revestimento.","","6"
"sug_tecido_uso","qual tecido|que tecido|melhor tecido pra|tecido ideal|sugere tecido|recomenda tecido","guiada","Para qual uso vocĂŞ quer indicaĂ§ĂŁo de tecido?","Escolha uma opĂ§ĂŁo: Clima quente|Clima frio|Uso diĂĄrio|Esporte|OcasiĂŁo formal","4"
"sug_tec_quente","tecido pra calor|tecido fresco|tecido leve|tecido respirĂĄvel|tecido pra verĂŁo","direta","Para calor: linho (fresco e respirĂĄvel), algodĂŁo leve (140g), viscose (cai bem e ventila), meia-malha penteada. Evite poliĂŠster puro no calor â abafa.","","6"
"sug_tec_frio","tecido pra frio|tecido quente|tecido grosso|tecido pra inverno","direta","Para frio: moletom flanelado (280g+), moletom peluciado, lĂŁ (peĂ§as sofisticadas), jeans pesado. SobreposiĂ§Ăľes funcionam melhor que uma Ăşnica peĂ§a grossa.","","6"
"sug_tec_diario","tecido resistente|tecido durĂĄvel|tecido pra usar muito|tecido prĂĄtico","direta","Para uso diĂĄrio: algodĂŁo (durĂĄvel, lavĂĄvel, nĂŁo amarrota tanto), malha mista (algodĂŁo + poliĂŠster â resistente e fĂĄcil de cuidar), jeans para parte de baixo.","","6"
"sug_tec_esporte","tecido esportivo|tecido pra suor|tecido pra academia|tecido dry|tecido elĂĄstico","direta","Para esporte: poliĂŠster dry fit (seca rĂĄpido, leve), suplex (elĂĄstico, ideal para legging), microfibra anti-odor. Tecidos com tecnologia performam melhor que algodĂŁo para suor.","","6"
"sug_tec_formal","tecido formal|tecido elegante|tecido sofisticado|tecido pra festa|tecido com brilho","direta","Para ocasiĂŁo formal: viscose, alfaiataria (lĂŁ com poliĂŠster), seda sob demanda (parceiros com bem-estar animal certificado), algodĂŁo pima penteado. Tecidos com caimento e brilho discreto.","","6"
"tec_cores_estoque","cor do tecido|cores do tecido em estoque|tecido nas 12 cores|tecido branco|tecido preto|cores de tecido","direta","Mantemos os tecidos bĂĄsicos (algodĂŁo bĂĄsico, malha mista, moletom) nas 12 cores de estoque permanente: branco, preto, cinza mescla, cinza chumbo, marinho, royal, vermelho, vinho, verde militar, verde bandeira, amarelo e rosa. Outros tecidos (linho, viscose, etc) tĂŞm paleta mais restrita.","","6"
"disponibilidade_materiais","disponibilidade|matĂŠria-prima disponĂ­vel|material em estoque|matĂŠria-prima|materia prima|tecido em estoque|tecido disponĂ­vel|material disponivel|tem material","direta","A disponibilidade de matĂŠria-prima ĂŠ controlada pelo setor de almoxarifado, atualizada diariamente. Para consulta em tempo real sobre um material especĂ­fico, vou te encaminhar.","","6"
"reposicao_estoque","reposiĂ§ĂŁo|reposicao|vai ter de novo|quando volta|quando repĂľe|tĂĄ esgotado|esgotou|sem estoque","direta","ReposiĂ§ĂŁo de matĂŠria-prima ĂŠ decisĂŁo do setor de compras, que considera demanda e prazo dos fornecedores. Em mĂŠdia, tecidos bĂĄsicos sĂŁo repostos a cada 30 dias. Para informaĂ§ĂŁo especĂ­fica de quando determinado material volta, vou te encaminhar ao almoxarifado.","","6"
"pronta_entrega","pronta entrega|prontas|peĂ§a pronta|peĂ§as prontas|tem em estoque pra entrega|envio imediato|imediato","direta","A Fashion Flow trabalha sob demanda â produzimos apĂłs o pedido confirmado. NĂŁo mantemos estoque de peĂ§as prontas (apenas de matĂŠria-prima nas 12 cores). Para envio imediato, o setor de vendas pode verificar se hĂĄ sobras de produĂ§ĂŁo recente.","","6"
"previsao_prazo","previsĂŁo|previsao|prazo|prazos|quando fica pronto|quando chega|quanto tempo|quantos dias|tempo de produĂ§ĂŁo","guiada","Sobre prazos da produĂ§ĂŁo, qual sua dĂşvida?","Escolha uma opĂ§ĂŁo: Prazo padrĂŁo|Com personalizaĂ§ĂŁo|Pedido urgente|Pedido grande (500+)|Atraso de pedido","4"
"prazo_padrao","prazo padrĂŁo|prazo comum|prazo normal|prazo mĂŠdio|tempo mĂŠdio de produĂ§ĂŁo","direta","Prazo padrĂŁo de produĂ§ĂŁo: 15 a 30 dias Ăşteis dependendo da complexidade e do volume. PeĂ§as bĂĄsicas sem personalizaĂ§ĂŁo ficam em 15 a 20 dias. PeĂ§as com modelagem especĂ­fica ou personalizaĂ§ĂŁo, 25 a 30 dias.","","6"
"prazo_com_personalizacao","prazo com personalizaĂ§ĂŁo|prazo silk|prazo bordado|prazo dtf|prazo de estampa|prazo com bordado","direta","Com personalizaĂ§ĂŁo, some ao prazo padrĂŁo: silkscreen +5 a 7 dias Ăşteis, DTF +2 a 4 dias, bordado +3 a 7 dias, modelagem exclusiva +20 a 30 dias Ăşteis antes da produĂ§ĂŁo comeĂ§ar.","","6"
"prazo_urgente","urgente|pedido urgente|prazo curto|pra ontem|rĂĄpido|preciso rĂĄpido|tem como adiantar|adiantar prazo|urgencia|tenho urgencia","direta","Atendemos pedidos urgentes mediante disponibilidade da produĂ§ĂŁo e taxa adicional de urgĂŞncia (20% a 40% sobre o valor). PossĂ­vel reduzir o prazo em atĂŠ 40% para volumes pequenos. Para volumes acima de 200 peĂ§as, urgĂŞncia ĂŠ avaliada caso a caso.","","6"
"prazo_grande_pedido","prazo pedido grande|prazo lote grande|prazo 500 peĂ§as|prazo 1000 peĂ§as|prazo atacado","direta","Pedidos acima de 500 peĂ§as tĂŞm planejamento em lotes. Prazo total geralmente fica de 35 a 50 dias Ăşteis, mas o cliente recebe em entregas parciais a cada lote concluĂ­do (a cada 100 a 200 peĂ§as prontas). O setor de vendas faz cronograma personalizado.","","6"
"prazo_atraso","atrasou|atrasado|atraso|passou do prazo|prazo estourado|nĂŁo chegou|nao chegou|cadĂŞ meu pedido|cade meu pedido","direta","Se o prazo estĂĄ em atraso, isso ĂŠ tratado pelo setor de logĂ­stica, que tem informaĂ§ĂŁo consolidada do andamento. Vou te encaminhar.","","6"
"etapas_pedido","etapa do pedido|em que etapa|status do pedido|andamento do pedido|fase do pedido","guiada","Sobre o pedido em andamento, o que vocĂŞ quer saber?","Escolha uma opĂ§ĂŁo: Em que etapa estĂĄ|Alterar pedido|Cancelar pedido|Acompanhamento detalhado","4"
"etapa_consulta","qual etapa do pedido|fase do meu pedido|onde estĂĄ meu pedido|status atual","direta","O setor de produĂ§ĂŁo nĂŁo fornece status em tempo real do pedido para o cliente final â isso ĂŠ feito pelo setor de logĂ­stica, que consolida toda a informaĂ§ĂŁo. Vou te encaminhar.","","6"
"alterar_pedido","alterar pedido|mudar pedido|modificar pedido|trocar pedido|mudar cor|mudar tamanho do pedido|mudar quantidade","direta","AlteraĂ§Ăľes no pedido sĂł sĂŁo possĂ­veis enquanto estĂĄ na fase de modelagem (primeiros 2 a 3 dias apĂłs aprovaĂ§ĂŁo). ApĂłs o corte, alteraĂ§Ăľes sĂŁo inviĂĄveis. Para verificar se ainda ĂŠ possĂ­vel, fale com vendas.","","6"
"cancelar_pedido","cancelar pedido|cancelamento|desistir do pedido|desisti|quero cancelar|cancela","direta","Cancelamento de pedido ĂŠ tratado pelo setor de vendas, que verifica em qual estĂĄgio o pedido estĂĄ e quais condiĂ§Ăľes contratuais se aplicam (pode haver retenĂ§ĂŁo se a produĂ§ĂŁo jĂĄ comeĂ§ou).","","6"
"acompanhamento","acompanhar pedido|acompanhamento|tracking|rastrear pedido|seguir pedido","direta","Acompanhamento detalhado da produĂ§ĂŁo ĂŠ fornecido pelo setor de logĂ­stica, que consolida etapas e prazos. Vou te encaminhar.","","6"
"atende_empresa","atendem empresa|atendimento b2b|atendem pessoa jurĂ­dica|atendem pj|cnpj|nota fiscal|venda pra empresa|fornecedor de empresa","direta","Sim, atendemos empresas (PJ) com pedido mĂ­nimo de 50 peĂ§as. Emitimos nota fiscal, oferecemos condiĂ§Ăľes de pagamento corporativo (faturamento) e cronograma de entregas. Para fechamento, vou te encaminhar ao setor de vendas.","","6"
"private_label","private label|white label|peĂ§a com minha marca|produzem pra outras marcas|marca branca|peĂ§a sem marca|sem etiqueta","direta","Sim, fazemos private label (produzimos para outras marcas usarem etiqueta prĂłpria). Inclui: produĂ§ĂŁo sem nossa etiqueta, etiqueta da sua marca, embalagem neutra ou com sua identidade. MĂ­nimo de 100 peĂ§as por modelo. O setor de vendas explica as condiĂ§Ăľes contratuais.","","6"
"revenda","revender|revendedor|revenda|comprar pra revender|atacadista|distribuidor|distribuir|sacoleira","direta","Trabalhamos com revendedores. CondiĂ§Ăľes: cadastro de CNPJ ativo, primeira compra mĂ­nima de 100 peĂ§as mistas, descontos progressivos a partir da segunda compra. Para fechamento de parceria, vou te encaminhar ao setor de vendas.","","6"
"uniforme_escolar","uniforme escolar|uniforme de escola|farda escolar|camiseta escolar|conjunto escolar","direta","Fazemos uniforme escolar com personalizaĂ§ĂŁo (logo da escola, nome do aluno). Atendemos escolas com pedido mĂ­nimo de 100 peĂ§as por modelo. O contrato pode prever entregas escalonadas durante o ano. Setor de vendas faz o orĂ§amento.","","6"
"atendente_humano","atendente|humano|pessoa real|quero falar com gente|falar com humano|tem alguĂŠm aĂ­|sĂł robĂ´|so robo|me transfere|falar com alguĂŠm|atendimento humano|gente real|com uma pessoa|pra uma pessoa|falar com uma pessoa|pessoa de verdade","direta","Sem problema! Vou te transferir para um atendente humano do setor de produĂ§ĂŁo. Atendimento humano: segunda a sexta, 8h Ă s 18h. Fora desse horĂĄrio, deixe sua dĂşvida que respondemos no prĂłximo dia Ăştil.","","3"
"sobre_o_bot","vocĂŞ ĂŠ ia|voce e ia|ĂŠ robĂ´|e robo|vocĂŞ ĂŠ humano|qual seu nome|vocĂŞ usa chatgpt|vocĂŞ ĂŠ gpt|inteligĂŞncia artificial|quem ĂŠ vocĂŞ|robĂ´ da empresa","direta","Sou o assistente virtual do setor de produĂ§ĂŁo da Fashion Flow. Fui criado para responder dĂşvidas sobre nosso processo, tecidos, personalizaĂ§ĂŁo e prazos. Se preferir falar com um atendente humano, ĂŠ sĂł pedir!","","3"
"horario_atendimento","horĂĄrio de atendimento|horario de atendimento|horĂĄrio|horario|funcionam que horas|atendem que horas|hora de funcionamento|fim de semana|sĂĄbado|sabado|domingo|feriado|que horas","direta","O bot da produĂ§ĂŁo atende 24/7. O atendimento humano funciona de segunda a sexta, das 8h Ă s 18h. NĂŁo atendemos no fim de semana nem em feriados nacionais. Pedidos urgentes do fim de semana entram na fila do prĂłximo dia Ăştil.","","3"
"fallback","","fallback","Hmm, nĂŁo consegui entender bem. Posso te ajudar com: produĂ§ĂŁo, tecidos, personalizaĂ§ĂŁo, qualidade, sustentabilidade, cuidados, prazos e catĂĄlogo. Sobre qual desses vocĂŞ quer saber? Se for outro assunto (preĂ§o, entrega, devoluĂ§ĂŁo), me avisa que encaminho para o setor certo.","","1"
"setor_almoxarifado","almoxarifado|estoque|estocagem|matĂŠria-prima em estoque|controle de estoque","encaminhamento","Para consulta de estoque e disponibilidade de matĂŠria-prima, vou te encaminhar ao chatbot do almoxarifado: (inserir link).","","9"
"setor_vendas","comprar|compras|vender|venda|preĂ§o|preco|valor|valores|custa|quanto custa|tabela de preĂ§os|pagamento|pagar|pix|cartĂŁo|boleto|parcelar|Ă  vista|desconto|promoĂ§ĂŁo|tĂĄ caro|orĂ§amento|orcamento|fechar pedido|quanto sai|quanto cobram|quanto voces cobram","encaminhamento","Para informaĂ§Ăľes sobre valores, formas de pagamento, descontos e fechamento de pedido, vou te encaminhar ao chatbot de vendas: (inserir link).","","9"
"setor_compras","fornecedor|fornecedores|setor de compras|ĂĄrea de compras|aquisiĂ§ĂŁo|comprar material|comprar tecido","encaminhamento","Para assuntos relacionados a fornecedores e aquisiĂ§ĂŁo de matĂŠria-prima, vou te encaminhar ao chatbot de compras: (inserir link).","","9"
"setor_logistica","encomenda|entrega|entregam|envio|enviado|frete|transportadora|prazo de entrega|regiĂŁo de entrega|exterior|exportaĂ§ĂŁo|rastreamento|rastrear|cep|onde estĂĄ meu pedido|correios|sedex","encaminhamento","Para informaĂ§Ăľes sobre entrega, frete, rastreamento e prazos de envio, vou te encaminhar ao chatbot de logĂ­stica: (inserir link).","","9"
"setor_devolucao","devoluĂ§ĂŁo|devolucao|devolver|troca|trocar|tamanho errado|garantia|veio com defeito|problema com a peĂ§a|reclamar|trocar peĂ§a|devolvo|dinheiro de volta|reembolso","encaminhamento","Para solicitaĂ§Ăľes de troca, devoluĂ§ĂŁo ou problemas com a peĂ§a recebida, vou te encaminhar ao chatbot de devoluĂ§Ăľes: (inserir link).","","9"
"elogios1","muito bom|perfeito|perfeita|parabĂŠns|sensacional|mandou bem|ficou bom|ficou Ăłtimo|que lindo|que massa|gostei muito|nota 10|top|show de bola|show|impressionada|impressionado|Ăłtimo|surpreendente|excelente","direta","Aaah, muito obrigada pelo elogio! Fico feliz em ajudar. Qualquer outra dĂşvida, ĂŠ sĂł chamar.","","3"
"elogios2","amei|adorei|nem amo|arrasou|que tudo|belĂ­ssimo|divou|diva muito|divonico|arrasa|pisa muito|cunt|achei cunt|amo|achei tudo|maravilhoso|sou fĂŁ","direta","Aaai amei demais, divou! Tamo junto, qualquer coisa ĂŠ sĂł chamar đ","","3"
"ofensas","porra|desgraĂ§a|caralho|fdp|filha da puta|idiota|burro|inĂştil|ridĂ­culo|incompetente|horrĂ­vel|bosta|merda|vagabundo|imbecil|otĂĄrio|cuzĂŁo|arrombado|maldito|miserĂĄvel|vsf|vai se foder|seu lixo|peste|safado|canalha|lixo|vai tomar no cu|vtnc|babaca|palhaĂ§o|retardado|droga|esse bot ĂŠ uma droga|esse bot ĂŠ horrĂ­vel","direta","Entendo que possa estar frustrado e peĂ§o desculpas se algo te incomodou. Vou continuar tentando te ajudar â me conta o que estĂĄ acontecendo. Se preferir, posso te encaminhar para um atendente humano.","","3"
"combinado_prazo_qtd_produto","prazo de 100 camisetas|prazo de 50 polos|prazo de 200 moletons|quanto tempo 100 peĂ§as|quando fica pronto 500 peĂ§as|prazo pra 1000 uniformes|prazo para 100 vestidos|prazo de bermudas|prazo de jeans|prazo de calĂ§a|prazo de jaqueta","combinada","Consultar tabela lookup_prazo com slots {produto, quantidade, personalizacao}. Resposta dinĂ˘mica.","Me confirma: qual o produto, quantas peĂ§as e se tem personalizaĂ§ĂŁo (silk, DTF, bordado ou nenhuma)?","9"
"combinado_prazo_personalizacao_produto","prazo camiseta bordada|prazo polo bordada|prazo camiseta com silk|prazo moletom com estampa|prazo uniforme com logo|prazo de bordado em jeans|tempo de uniforme bordado|prazo polo com logo","combinada","Consultar tabela lookup_prazo. Resposta dinĂ˘mica com base em {produto, personalizacao, quantidade}.","Me confirma: qual o produto, quantas peĂ§as e qual a tĂŠcnica de personalizaĂ§ĂŁo?","9"
"combinado_preco_qtd_produto","preĂ§o de 100 camisetas|preĂ§o de 50 polos|valor de 200 moletons|quanto custa 100 polos|orĂ§amento 500 camisetas|valor unitĂĄrio 100 peĂ§as|preĂ§o camiseta atacado|preĂ§o polo atacado","combinada","Consultar tabela lookup_preco com slots {produto, quantidade, personalizacao}. Valor indicativo, fechar com vendas.","Me confirma: produto, quantidade e personalizaĂ§ĂŁo (se tiver). Posso te dar uma faixa indicativa e te encaminhar pra vendas pra fechar o valor.","9"
"combinado_preco_personalizacao","quanto custa personalizaĂ§ĂŁo|quanto fica com bordado|quanto fica com silk|quanto fica com estampa|preĂ§o com personalizaĂ§ĂŁo|preĂ§o com bordado|preĂ§o com logo","combinada","Consultar lookup_preco. PersonalizaĂ§ĂŁo adiciona 10% a 40% sobre o valor base, dependendo da tĂŠcnica.","Pra te dar a faixa: qual produto, quantidade e qual a tĂŠcnica de personalizaĂ§ĂŁo?","9"
"combinado_desconto_volume","desconto por volume|desconto pra atacado|desconto progressivo|quanto desconto pra 500|quanto desconto pra 1000|desconto grande quantidade|desconto pra empresa","direta","Trabalhamos com desconto progressivo por volume: 31-100 peĂ§as â 5%; 101-300 â 10%; 301-500 â 15%; 501-1000 â 20%; acima de 1000 â 25% (negociĂĄvel com vendas). Descontos aplicados sobre o valor unitĂĄrio base.","","6"
"combinado_tecido_em_produto","algodĂŁo em camiseta|jeans em camiseta|viscose em camiseta|linho em vestido|moletom em jaqueta|alfaiataria em calĂ§a|dry fit em camiseta|suplex em legging|fazem camiseta em linho|fazem polo em pima|polo em algodĂŁo pima","combinada","Consultar lookup_compat_tecido_produto com slots {tecido, produto}. Retorna compatĂ­vel ou alternativa recomendada.","Me confirma: qual produto e qual tecido vocĂŞ quer combinar?","9"
"combinado_tecidos_disponiveis_para_produto","quais tecidos pra camiseta|quais tecidos pra polo|quais tecidos pra vestido|quais tecidos pra calĂ§a|quais tecidos pra moletom|quais tecidos pra uniforme|tecidos disponĂ­veis pra","combinada","Depende do produto! Me diz qual (camiseta, moletom, calĂ§a, vestido...) que eu listo os tecidos que combinam.","Qual produto vocĂŞ quer saber os tecidos disponĂ­veis?","9"
"combinado_personalizacao_em_tecido","bordado em jeans|bordado em viscose|bordado em algodĂŁo|silk em algodĂŁo|silk em viscose|silk em moletom|silk em jeans|dtf em poliĂŠster|dtf em algodĂŁo|bordado em dry fit|estampa em viscose|bordado em lĂŁ|personalizar em viscose","combinada","Consultar lookup_compat_tecido_personalizacao com slots {tecido, personalizacao}. Retorna recomendaĂ§ĂŁo tĂŠcnica.","Me diga o tecido e a tĂŠcnica de personalizaĂ§ĂŁo que vocĂŞ quer combinar.","9"
"combinado_cor_em_tecido","camiseta verde militar em algodĂŁo|moletom vermelho|viscose rosa|linho branco|jeans azul|tem camiseta amarela|tem polo branca|tem vestido preto|cor em estoque|cor pronta entrega|tem em estoque cor","combinada","Consultar lookup_cor_tecido com slots {cor, tecido}. Retorna se estĂĄ em estoque permanente ou se ĂŠ tingimento sob demanda.","Me confirma: qual cor e qual tecido (ou tipo de peĂ§a)?","9"
"combinado_cores_disponiveis_para_tecido","cores em algodĂŁo|cores em moletom|cores em viscose|cores em jeans|cores em linho|cores disponĂ­veis em|quais cores tem em","combinada","Consultar lookup_cor_tecido e listar todas as cores em estoque permanente pro tecido consultado.","Qual tecido vocĂŞ quer saber as cores disponĂ­veis?","9"
